{
  "version": 1,
  "source": "current-local-state",
  "agents": [
    {
      "name": "architect",
      "status": "active",
      "mode": "subagent",
      "skill": "opencode-architect",
      "owner_lane": "@architect",
      "risk": [
        "architecture-advice",
        "read-only-boundary"
      ],
      "fallback": "@oracle for review or @artifact-planner for plan artifacts",
      "evidence": [
        "agents/architect.md",
        "skills/opencode-architect/SKILL.md"
      ],
      "source": "agents/architect.md"
    },
    {
      "name": "artifact-planner",
      "status": "active",
      "mode": "primary",
      "skill": "opencode-artifact-planner",
      "owner_lane": "@artifact-planner",
      "risk": [
        "plan-artifact-write",
        "scope-bloat"
      ],
      "fallback": "@orchestrator routing or retained specialist lane",
      "evidence": [
        "agents/artifact-planner.md",
        "skills/opencode-artifact-planner/SKILL.md"
      ],
      "source": "agents/artifact-planner.md"
    },
    {
      "name": "designer",
      "status": "active",
      "mode": "subagent",
      "skill": "opencode-designer",
      "owner_lane": "@designer",
      "risk": [
        "ui-change",
        "accessibility",
        "visual-parity"
      ],
      "fallback": "@orchestrator routing or retained specialist lane",
      "evidence": [
        "agents/designer.md",
        "skills/opencode-designer/SKILL.md"
      ],
      "source": "agents/designer.md"
    },
    {
      "name": "explorer",
      "status": "active",
      "mode": "subagent",
      "skill": "opencode-explorer",
      "owner_lane": "@explorer",
      "risk": [
        "read-only-discovery",
        "stale-map"
      ],
      "fallback": "targeted glob/grep/read by @orchestrator",
      "evidence": [
        "agents/explorer.md",
        "skills/opencode-explorer/SKILL.md"
      ],
      "source": "agents/explorer.md"
    },
    {
      "name": "fixer",
      "status": "active",
      "mode": "subagent",
      "skill": "opencode-fixer",
      "owner_lane": "@fixer",
      "risk": [
        "code-edit",
        "test-impact"
      ],
      "fallback": "@orchestrator routing or retained specialist lane",
      "evidence": [
        "agents/fixer.md",
        "skills/opencode-fixer/SKILL.md"
      ],
      "source": "agents/fixer.md"
    },
    {
      "name": "librarian",
      "status": "active",
      "mode": "subagent",
      "skill": "opencode-librarian",
      "owner_lane": "@librarian",
      "risk": [
        "external-research",
        "read-only-boundary"
      ],
      "fallback": "local docs first, then no external lookup",
      "evidence": [
        "agents/librarian.md",
        "skills/opencode-librarian/SKILL.md"
      ],
      "source": "agents/librarian.md"
    },
    {
      "name": "oracle",
      "status": "active",
      "mode": "subagent",
      "skill": "opencode-oracle",
      "owner_lane": "@oracle",
      "risk": [
        "review-advice",
        "read-only-boundary"
      ],
      "fallback": "@quality-gate for final conformance",
      "evidence": [
        "agents/oracle.md",
        "skills/opencode-oracle/SKILL.md"
      ],
      "source": "agents/oracle.md"
    },
    {
      "name": "orchestrator",
      "status": "active",
      "mode": "primary",
      "skill": "opencode-orchestrator",
      "owner_lane": "@orchestrator",
      "risk": [
        "routing",
        "integration",
        "scope-control"
      ],
      "fallback": "specialist lane or user clarification",
      "evidence": [
        "agents/orchestrator.md",
        "skills/opencode-orchestrator/SKILL.md"
      ],
      "source": "agents/orchestrator.md"
    },
    {
      "name": "quality-gate",
      "status": "active",
      "mode": "subagent",
      "skill": "opencode-quality-gate",
      "owner_lane": "@quality-gate",
      "risk": [
        "final-signoff",
        "read-only-boundary"
      ],
      "fallback": "block completion and return residual risks",
      "evidence": [
        "agents/quality-gate.md",
        "skills/opencode-quality-gate/SKILL.md"
      ],
      "source": "agents/quality-gate.md"
    },
    {
      "name": "visual-context-extractor",
      "status": "active",
      "mode": "subagent",
      "skill": "opencode-visual-context-extractor",
      "owner_lane": "@visual-context-extractor",
      "risk": [
        "read-only-boundary",
        "pii-handling",
        "overclaim"
      ],
      "fallback": "return status:unavailable when no vision input; orchestrator routes critique to @designer and source edits to @fixer",
      "evidence": [
        "agents/visual-context-extractor.md",
        "skills/opencode-visual-context-extractor/SKILL.md"
      ],
      "source": "agents/visual-context-extractor.md"
    }
  ],
  "skills": [
    {
      "name": "opencode-architect",
      "status": "active",
      "owner_lane": "@architect",
      "risk": [
        "architecture-advice"
      ],
      "fallback": "@oracle review",
      "evidence": [
        "skills/opencode-architect/SKILL.md"
      ],
      "source": "skills/opencode-architect/SKILL.md"
    },
    {
      "name": "opencode-artifact-planner",
      "status": "active",
      "owner_lane": "@artifact-planner",
      "risk": [
        "plan-artifact-write"
      ],
      "fallback": "@orchestrator routing",
      "evidence": [
        "skills/opencode-artifact-planner/SKILL.md"
      ],
      "source": "skills/opencode-artifact-planner/SKILL.md"
    },
    {
      "name": "opencode-backend",
      "status": "active",
      "owner_lane": "@fixer",
      "risk": [
        "api-change",
        "data-change",
        "auth-integration"
      ],
      "fallback": "@artifact-planner on-demand owner",
      "evidence": [
        "skills/opencode-backend/SKILL.md"
      ],
      "source": "skills/opencode-backend/SKILL.md"
    },
    {
      "name": "opencode-council",
      "status": "active",
      "owner_lane": "@artifact-planner",
      "risk": [
        "expensive-consensus"
      ],
      "fallback": "@artifact-planner on-demand owner",
      "evidence": [
        "skills/opencode-council/SKILL.md"
      ],
      "source": "skills/opencode-council/SKILL.md"
    },
    {
      "name": "opencode-designer",
      "status": "active",
      "owner_lane": "@designer",
      "risk": [
        "ui-change",
        "accessibility"
      ],
      "fallback": "@frontend/@mobile/@design-system-engineer for implementation",
      "evidence": [
        "skills/opencode-designer/SKILL.md"
      ],
      "source": "skills/opencode-designer/SKILL.md"
    },
    {
      "name": "opencode-design-system-engineer",
      "status": "active",
      "owner_lane": "@designer",
      "risk": [
        "shared-ui-foundation",
        "token-primitive-api-change"
      ],
      "fallback": "@artifact-planner on-demand owner",
      "evidence": [
        "skills/opencode-design-system-engineer/SKILL.md"
      ],
      "source": "skills/opencode-design-system-engineer/SKILL.md"
    },
    {
      "name": "opencode-devops",
      "status": "active",
      "owner_lane": "@fixer",
      "risk": [
        "deploy",
        "destructive-infra",
        "secrets"
      ],
      "fallback": "@artifact-planner on-demand owner",
      "evidence": [
        "skills/opencode-devops/SKILL.md"
      ],
      "source": "skills/opencode-devops/SKILL.md"
    },
    {
      "name": "opencode-explorer",
      "status": "active",
      "owner_lane": "@explorer",
      "risk": [
        "read-only-discovery"
      ],
      "fallback": "targeted local search",
      "evidence": [
        "skills/opencode-explorer/SKILL.md"
      ],
      "source": "skills/opencode-explorer/SKILL.md"
    },
    {
      "name": "opencode-fixer",
      "status": "active",
      "owner_lane": "@fixer",
      "risk": [
        "code-edit",
        "test-impact"
      ],
      "fallback": "@artifact-planner",
      "evidence": [
        "skills/opencode-fixer/SKILL.md"
      ],
      "source": "skills/opencode-fixer/SKILL.md"
    },
    {
      "name": "opencode-frontend",
      "status": "active",
      "owner_lane": "@fixer",
      "risk": [
        "web-ui-change",
        "accessibility",
        "api-integration"
      ],
      "fallback": "@artifact-planner on-demand owner",
      "evidence": [
        "skills/opencode-frontend/SKILL.md"
      ],
      "source": "skills/opencode-frontend/SKILL.md"
    },
    {
      "name": "opencode-fullstack",
      "status": "active",
      "owner_lane": "@fixer",
      "risk": [
        "cross-layer-change",
        "scope-creep"
      ],
      "fallback": "@artifact-planner on-demand owner",
      "evidence": [
        "skills/opencode-fullstack/SKILL.md"
      ],
      "source": "skills/opencode-fullstack/SKILL.md"
    },
    {
      "name": "opencode-librarian",
      "status": "active",
      "owner_lane": "@librarian",
      "risk": [
        "external-research"
      ],
      "fallback": "local docs only",
      "evidence": [
        "skills/opencode-librarian/SKILL.md"
      ],
      "source": "skills/opencode-librarian/SKILL.md"
    },
    {
      "name": "opencode-mobile",
      "status": "active",
      "owner_lane": "@fixer",
      "risk": [
        "native-permissions",
        "privacy",
        "mobile-runtime"
      ],
      "fallback": "@artifact-planner on-demand owner",
      "evidence": [
        "skills/opencode-mobile/SKILL.md"
      ],
      "source": "skills/opencode-mobile/SKILL.md"
    },
    {
      "name": "opencode-oracle",
      "status": "active",
      "owner_lane": "@oracle",
      "risk": [
        "review-advice"
      ],
      "fallback": "@quality-gate",
      "evidence": [
        "skills/opencode-oracle/SKILL.md"
      ],
      "source": "skills/opencode-oracle/SKILL.md"
    },
    {
      "name": "opencode-orchestrator",
      "status": "active",
      "owner_lane": "@orchestrator",
      "risk": [
        "routing",
        "integration"